PMID,title,abstract
16691064,"Atazanavir and lopinavir/ritonavir: pharmacokinetics, safety and efficacy of a promising double-boosted protease inhibitor regimen.","OBJECTIVE: To assess the pharmacokinetics and tolerability of lopinavir (LPV), ritonavir (RTV) and atazanavir (ATV) as a double-boosted protease inhibitor regimen in HIV-infected adults. METHODS: Sixteen patients who started LPV/RTV (400/100 mg b.i.d.) and ATV (300 mg q.d.) were enrolled in the study group (arm A). LPV pharmacokinetics were compared to those of two historical groups: arm B, 15 patients who received LPV/RTV (400/100 mg b.i.d.); and arm C, 25 patients who received LPV/RTV/saquinavir (SQV) (400/100/1000 mg b.i.d.). ATV pharmacokinetics were compared to those of 15 consecutive patients who received ATV and RTV (300/100 mg q.d.) (arm D). Drug concentrations were measured by HPLC. RESULTS: LPV concentrations were significantly higher in arm A than in arms B and C. Median (interquartile range) LPV area under the curve (AUC)0-12 values were 115.7 (99.8-136.5), 85.2 (68.3-109.2) and 85.1 (60.6-110.1) microg/h/ml, respectively. C(max) values were 12.2 (10.7-14.5), 9.5 (6.8-13.9) and 10.0 (6.9-13.6) microg/ml, respectively. C(min) values were 9.1 (7.1-10.4), 5.6 (4.7-8.2) and 5.5 (4.2-7.5) microg/ml, respectively. No difference was observed for ATV AUC0-24 or C(max) between arms A and D. ATV C(min) values were 1.07 (0.61-1.79) in arm A and 0.58 (0.32-0.83) in arm D (P = 0.001). Treatment was not discontinued in any patient because of adverse effects. At 24 weeks, viral load was < 50 copies/ml in 13 of 16 patients. CONCLUSIONS: The combination of ATV and LPV/RTV provided high plasma concentrations of both PI, which seemed to be appropriate for patients with multiple prior therapeutic failures, yielding good tolerability and substantial antiviral efficacy."
16723569,Pregnancy-related effects on nelfinavir-M8 pharmacokinetics: a population study with 133 women.,"A relationship between nelfinavir antiretroviral efficacy and plasma concentrations has been previously established. As physiological changes associated with pregnancy have a large impact on the pharmacokinetics of many drugs, a nelfinavir population study with women was developed, and the large intersubject variability was analyzed in order to optimize individual treatment schedules for this drug during pregnancy. A population pharmacokinetic model was developed in order to describe the concentration time course of nelfinavir and its metabolite M8 in pregnant and nonpregnant women. Individual characteristics, such as age, body weight, and weeks of gestation or delivery, which may influence nelfinavir-M8 pharmacokinetics were investigated. Data from therapeutic drug monitoring in 133 women treated with nelfinavir were retrospectively analyzed with NONMEM. Nelfinavir pharmacokinetics was described by a one-compartment model with linear absorption and elimination and M8 produced from the nelfinavir central compartment. Mean pharmacokinetic estimates and the corresponding intersubject percent variabilities for a nonpregnant woman were the following: absorption rate, 0.83 h(-1); absorption lag time, 0.85 h; apparent nelfinavir elimination clearance (CL(10)/F), 35.5 liters/h (50%); apparent volume of distribution (V/F), 596 liters (118%); apparent formation clearance to M8 (CL(1M)/F), 0.65 liters/h (69%); and M8 elimination rate constant (k(M0)), 3.3 h(-1) (59%). During pregnancy, we observed significant increases in nelfinavir (44.4 liters/h) and M8 (5 h(-1)) elimination but unchanged nelfinavir transformation clearance to M8, suggesting an induction of CYP3A4 but no effect on CYP2C19. Apparent nelfinavir clearance and volume showed a twofold increase on the day of delivery, suggesting a decrease in bioavailability on this day. The M8 elimination rate was increased by concomitant administration of nonnucleoside reverse transcriptase inhibitors. A trough nelfinavir plasma concentration above 1 mg/liter was previously shown to improve the antiretroviral response. The Bayesian individual pharmacokinetic estimates suggested that the dosage should not be changed in pregnant women but may be doubled on the day of delivery."
16758435,Concurrent use of efavirenz and oxcarbazepine may not affect efavirenz plasma concentrations.,
16765009,Simple determination of the HIV protease inhibitor atazanavir in human plasma by high-performance liquid chromatography with UV detection.,"A simple high-performance liquid chromatography method for the determination of the human immunodeficiency virus protease inhibitor atazanavir in human plasma samples was developed and validated. The method involved a rapid and simple solid-phase extraction of atazanavir using Oasis HLB 1cc cartridges, an isocratic reversed-phase liquid chromatography on an XTerra RP18 (150mmx4.6mm, 3.5microm) column, and ultraviolet detection at 203nm. The mobile phase consisted of phosphate buffer (pH 6, 52.5mM) and acetonitrile (43:57, v/v). Up to 48 samples could be measured in one day since the run-time of one sample was 30min. The assay was linear from 0.04 to 10microg/ml with a lower limit of quantification of 0.04microg/ml. The mean absolute recovery of ATV was 98.1%. The method was precise, with both intra-day and inter-day coefficients of variation < or =3.0%, and accurate (deviations ranged from -3.0% to 4.5% and from -3.6% to 4.7% for intra-day and inter-day analysis, respectively). There was no interference from 35 tested potentially co-administrated drugs. This method provides a simple, sensitive, precise and reproducible assay for the therapeutic drug monitoring of atazanavir in clinical routine of laboratories with standard equipment."
16778716,Are plasma levels valid surrogates for cellular concentrations of antiretroviral drugs in HIV-infected patients?,"Total plasma concentrations are currently measured for therapeutic drug monitoring of HIV protease inhibitors (PIs) and nonnucleoside reverse transcriptase inhibitors (NNRTIs). However, the pharmacological target of antiretroviral drugs reside inside cells. To study the variability of their cellular accumulation, and to determine to which extent total plasma concentrations (TPC) correlate with cellular concentrations (CC), plasma and peripheral blood mononuclear cells (PBMCs) were simultaneously collected at single random times after drug intake from 133 HIV infected patients. TPC levels were analysed by high-performance liquid chromatography with ultraviolet detection and CC by LC-MS/MS from peripheral blood mononuclear cells. The best correlations between TPC and CC were observed for nelfinavir (NFV, slope=0.93, r=0.85), saquinavir (SQV, slope=0.76, r=0.80) and lopinavir (LPV, slope=0.87, r=0.63). By contrast, TPC of efavirenz (EFV) exhibited a moderate correlation with CC (slope=0.69, r=0.58), while no correlation was found for nevirapine (NVP, slope=-0.3, r=0.1). Interindividual variability in the CC/TPC ratio was lower for protease inhibitors (coefficients of variation 76%, 61%, and 80% for SQV, NFV and LPV, respectively) than for nonnucleoside reverse transcriptase inhibitors (coefficients of variation 101% and 318%, for EFV and NVP). As routine CC measurement raises practical difficulties, well-correlated plasma concentrations (ie, NFV, SQV and LPV) can probably be considered as appropriate surrogates for cellular drug exposure. For drugs such as EFV or NVP, there may be room for therapeutic drug monitoring improvement using either direct CC determination or other predictive factors such as genotyping of transporters or metabolizing enzyme genes."
16778721,"Quality assurance program for pharmacokinetic assay of antiretrovirals: ACTG proficiency testing for pediatric and adult pharmacology support laboratories, 2003 to 2004: a requirement for therapeutic drug monitoring.","Proficiency testing (PT) is a mandated requirement for clinical laboratories doing therapeutic drug monitoring and is an invaluable tool to help laboratories identify and correct problems in analytical procedures. The AIDS Clinical Trial Group Pharmacology Quality Assurance Committee implemented a new antiretroviral PT program for all currently available antiretroviral drugs in 2001. The PT program was designed for the AIDS Clinical Trial Group Pharmacology Specialty Laboratories actively involved in assaying these drugs in clinical trial samples so as to comply with the Clinical Laboratory Improvement Amendments. Results from the first 3 rounds of PT have been analyzed and reported and provided support for formalizing the guidelines of the PT testing program. The PT program has expanded with the addition of nucleoside reverse transcription inhibitors (NRTIs) and atazanavir. This report includes results from rounds 4 to 7 over 2 additional years of standard operations. Additionally we include results from NRTIs for all rounds and atazanavir for a single round. There were 9 participating laboratories. Eight used high-performance liquid chromatography as the primary method of detection and 2/8 also reported LC-MS-MS results. One laboratory used LC-MS-MS as their primary detection method. All laboratories measured protease inhibitors, most measured at least 1 non-nucleoside reverse transcription inhibitor and 5 had NRTI capabilities. Results were normally distributed and the acceptance range of +/-20% best corresponded to a 95% confidence interval. Overall score for 9 participating laboratories was 96% correct out of 1826 challenges over 4 rounds. Laboratories scored 95, 98 and 97% correct for protease inhibitors, non-nucleoside reverse transcription inhibitorss and NRTIs, respectively. Three laboratories reporting LC-MS-MS results had 92% correct (347/378) challenges for all drugs. The percentage of correct results is about the same as previously reported. There is a continued need for a PT program to help participating laboratories maintain essential quality assurance and quality control."
16783049,Urine nevirapine as a predictor of antiretroviral adherence.,"BACKGROUND & OBJECTIVE: Incomplete adherence is a major contributor to failure of antiretroviral therapy. Although the available methods to monitor adherence to therapy have proved to be predictive of outcomes, the results are variable. We assessed the feasibility of detecting nevirapine (NVP) in spot urine samples to monitor patient adherence to antiretroviral treatment and to study the urinary excretion of NVP in healthy volunteers after oral administration of a single dose of NVP (200 mg). METHODS: Spot urine samples were collected from 50 HIV-infected patients (36 on treatment regimen containing NVP and 14 on drugs other than NVP) and tested for NVP by HPLC in a blinded manner. Sixteen healthy volunteers (9 males and 7 females) were administered a single oral dose of 200 mg NVP and spot urine samples were collected on day '0' before drug administration, and thereafter every 24 h up to 9 days and tested for NVP. RESULTS: All the urine samples collected from patients undergoing treatment with NVP-containing regimens at different time points after drug administration tested positive for NVP. Thirteen out of 14 samples from patients not on NVP yielded a negative result. The drug was detected in the urine of healthy volunteers up to 9 days. The urinary excretion of NVP was prolonged in females than in males. INTERPRETATION & CONCLUSION: In view of its long half-life, NVP gets excreted in urine for a long period of time. Hence, testing spot urine samples for NVP may not be a useful measure to monitor patient adherence to treatment."
16798621,Therapeutic drug monitoring in HIV treatment: a literature review.,"PURPOSE: Therapeutic drug monitoring (TDM) is the practice of managing plasma drug concentrations. This intervention can potentially improve inadequate antiretroviral dosing in the treatment of HIV infection. Our objective was to review the evidence regarding TDM in HIV management. METHOD: We searched MEDLINE using the following key words: therapeutic drug monitoring, HIV infection, pharmacokinetics, antiretroviral therapy, protease inhibitors, antiretroviral-naive, antiretroviral-experienced, and salvage therapy. inclusion criteria required definition of optimal concentration thresholds and measures of treatment effectiveness at these targets. RESULTS: Our search yielded 39 studies. 11 studies met inclusion criteria. 4 studies compared efficacy of TDM to standard of care (SOC) interventions via randomized clinical trials and were grouped as ""interventional."" 7 studies retrospectively defined thresholds from observed differences in outcome and were grouped as ""observational."" 3 interventional studies targeted similar indinavir concentrations (Cmin = 0.10-0.15 mg/L). 2 of these studies increased achievement of target serum levels and percentages of undetectable viral load (23%-41%, p < or = .009) with TDM implementation. CONCLUSION: TDM can effectively target antiretroviral threshold concentrations and improve virologic suppression in some cases. Further work is needed to define plasma thresholds and assess the value of TDM in HIV management."
16804749,Assessing antiretroviral adherence via electronic drug monitoring and self-report: an examination of key methodological issues.,"We explored methodological issues related to antiretroviral adherence assessment, using 6 months of data collected in a completed intervention trial involving 136 low-income HIV-positive outpatients in the Bronx, NY. Findings suggest that operationalizing adherence as a continuous (versus dichotomous) variable and averaging adherence estimates over multiple assessment points (versus using only one) explains greater variance in HIV-1 RNA viral load (VL). Self-reported estimates provided during a phone interview accounted for similar variance in VL as EDM estimates (R (2) = .17 phone versus .18 EDM). Self-reported adherence was not associated with a standard social desirability measure, and no difference in the accuracy of self-report adherence was observed for assessment periods of 1-3 days. Self-reported poor adherence was more closely associated with EDM adherence estimates than self-reported moderate and high adherence. On average across assessment points, fewer than 4% of participants who reported taking a dose of an incorrect amount of medication."
16810086,A step-by-step approach to HIV/AIDS.,
16810112,Range of normal neutrophil counts in healthy zimbabwean infants: implications for monitoring antiretroviral drug toxicity.,"Mother-to-child HIV prevention trials in sub-Saharan Africa use the US National Institutes of Health Division of AIDS (DAIDS) grading scale to monitor hematologic toxicity. A recent study of nevirapine prophylaxis given for 6 months in breast-feeding Zimbabwean infants reported several cases of relative neutropenia in clinically well infants, raising concerns of drug toxicity. However, the DAIDS tables are based on normal blood counts for white infants, although there is evidence that black African infants may have lower absolute neutrophil counts (ANCs) than white infants. To establish normal hematologic values in black Zimbabwean infants and to quantify the apparent prevalence of relative neutropenia in this population, we evaluated HIV-uninfected healthy infants born to HIV-uninfected women at birth, 10 days, 6 weeks, 3, and 4 months of life. A physical examination and blood count were performed at each visit, and an HIV test was performed at the final visit. The ANC values were graded using the DAIDS table. A total of 145 healthy term infants satisfied the inclusion criteria. The mean ANC values for Zimbabwean infants were less than half of the corresponding standard values at all 5 time points (P < 0.0001). Using the DAIDS table in use at the time that the blood was collected, 57% of these healthy infants had relative neutropenia of any grade at birth, followed by 29% at day 10, 53% at 6 weeks, 32% at 3 months, and 37% at 4 months of life. Our data indicate that relative neutropenia exists in healthy black Zimbabwean infants. The guidelines for identifying toxicity were changed in December 2004. However, even by the new DAIDS tables, 43%, 23%, 24%, 42%, and 43% of these healthy babies had relative neutropenia at the time of the 5 visits. Future HIV prevention and treatment trials in sub-Saharan Africa should use normal hematologic values derived from African infants to avoid the overestimation of antiretroviral drug toxicity."
16847404,National adult antiretroviral therapy guidelines in resource-limited countries: concordance with 2003 WHO guidelines?,"AIMS: To investigate the existence of national adult antiretroviral therapy (ART) guidelines in 43 World Health Organization (WHO) '3 by 5' focus countries and compare their content with the 2003 WHO ART guidelines. METHODS: Questionnaires covered initiation of ART, selection of first or second-line ART, monitoring treatment response and toxicity and dissemination of national guidelines. Weighted concordance scores were created and country scores correlated with national indicators and WHO recommendations. RESULTS: Thirty-nine (91%) countries returned questionnaires, three of which had no national ART guidelines. Of the 36, 16 (44%) recommended to start ART based on WHO clinical staging criteria and CD4 cell count or T-lymphocyte count, 12 (33%) WHO clinical staging criteria and CD4 cell count, four (11%) only CD4 cell counts. 35 (97%) recommended a standard first-line regimen and 24 (67%) preferred stavudine + lamivudine + nevirapine; 33 (92%) recommended second-line regimens, and 24 (60%) preferred abacavir + didanosine + lopinavir/ritonavir. Thirty-one (94%) recommended CD4 cell count, possibly combined with other indicators, to monitor ART. Concordance scores were higher in countries with lower health expenditure per capita (P = 0.009) and lower GDP per capita (P < 0.03). Median concordance scores for starting ART was 100 [interquartile range (IQR), 67 to 100]; first line therapy, 70 (IQR, 60 to 80); second-line regimens, 45 (IQR, 27 to 55) and for laboratory investigations, 80 (IQR, 80 to 100). CONCLUSIONS: Most countries had developed national ART guidelines as part of a comprehensive national HIV program. Concordance with WHO recommendations was strong on starting first-line ART regimens and routine monitoring but lower for second-line recommendations."
16857630,Genotyping of CYP2B6 and therapeutic drug monitoring in an HIV-infected patient with high efavirenz plasma concentrations and severe CNS side-effects.,"We present a case with important pharmacogenetic and pharmacokinetic aspects of antiretroviral therapy in a patient with high efavirenz concentrations, severe CNS side-effects and low lopinavir concentrations. Despite therapeutic drug monitoring and subsequent efavirenz dosage reductions, side-effects did not resolve completely and lopinavir concentrations remained relatively low."
16863456,Pharmacokinetic drug interactions with non-nucleoside reverse transcriptase inhibitors.,"Non-nucleoside reverse transcriptase inhibitors (NNRTIs) are a diverse group of compounds that inhibit HIV Type 1 reverse transcriptase. Although possessing a common mechanism of action, the approved NNRTIs, delavirdine, efavirenz and nevirapine, differ in structural and pharmacokinetic characteristics. Each of the NNRTIs undergoes biotransformation by the cytochrome P450 (CYP) enzyme system, thus making them prone to clinically significant drug interactions when combined with other antiretrovirals. In addition, they interact with other concurrent medications and complementary/alternative medicines, acting as either inducers or inhibitors of drug-metabolising CYP enzymes. These drug interactions become an important consideration in the clinical use of these agents when designing combination regimens, as recommended by current guidelines. This review provides an updated summary of pharmacokinetic interactions with NNRTIs."
16885718,Determination of tipranavir in human plasma by reverse phase liquid chromatography with UV detection using photodiode array.,"Tipranavir has recently received accelerated approval from the FDA. The initial clinical use of tipranavir will be for patients with prior virologic failure with the presence of key HIV-1 protease inhibitor mutations. In Phase III trials patients with greater virologic response also had higher trough tipranavir concentrations (BI product information 2005). In addition, hepatotoxicity was concentration-related with a higher incidence in those patients exceeding a trough plasma concentration of 48.2 microg/mL (80 microM). Therefore, tipranavir may be an HIV-1 protease inhibitor for which therapeutic drug monitoring (TDM) may be helpful in optimizing outcomes. To quantitate tipranavir concentrations in human plasma, a method using reversed phase high performance liquid chromatography (RP-HPLC) was validated. Detection was effected using a photodiode-array detector, scanning at a wavelength of 254 nm. This method allows for detection of tipranavir to a lower limit of quantitation of 0.390 microg/mL with an interday variation in control value ranging from 2.9 to 4.6%. The method is being used in a clinical therapeutic drug monitoring program that is ongoing in our laboratory."
16885719,Full validation of an analytical method for the HIV-protease inhibitor atazanavir in combination with 8 other antiretroviral agents and its applicability to therapeutic drug monitoring.,"Because HIV medications are used in combination, it is important to develop multiplex assays to streamline the therapeutic drug monitoring process and provide rapid turnaround. This article reports full validation of an analytical method that combines atazanavir with 6 HIV-protease inhibitors (indinavir, amprenavir, saquinavir, nelfinavir, ritonavir, and lopinavir) and 2 nonnucleoside reverse transcriptase inhibitors (nevirapine and efavirenz). Using 200 microL of plasma and a simple liquid-liquid extraction method, this analytical method achieved a clean baseline and high extraction efficiencies (90.0% to 99.5%). A Zorbax C-18 (150 x 4.6 mm, 3.5 microm) analytical column was used along with a 27-minute linear gradient elution of the mobile phase to provide sharp peaks at 210 nm. This method was validated over a range of 25 to 10,000 ng/mL and is accurate (90.4% to 110.5%) and precise (precision within a day and between days ranged from 2.3% to 8.3%). Because this method is simple and inexpensive, it may have applicability in countries with low resources."
16940819,HIV and pregnancy: considerations for nursing practice.,"This article describes current nursing practice for pregnant women with HIV. In the United States, the number of new cases of HIV continues to rise in women of childbearing age. Women often learn of their HIV status when a pregnancy involves them in the healthcare delivery system. Since the manifestation of the disease in 1981, there have been significant advances in treatment, and now, among pregnant women testing positive for HIV, the risk of perinatal transmission can be decreased to 1% with pharmacologic intervention. Yet, HIV disease poses many new challenges to the woman testing positive who is considering pregnancy or who is already pregnant. The progression of the symptoms of AIDS is similar to the common symptoms of pregnancy; the HIV medications may also cause these symptoms. Adherence to the HIV medication regime is necessary for ongoing viral suppression, for missed doses can initiate drug resistance and the whole categories of antiretroviral drugs may become ineffective. Additionally, the HIV stigma continues to impact those infected and interferes with the access to healthcare. HIV poses a major challenge for the nurse caring for the childbearing woman."
16970510,Neuropsychiatric complications of antiretroviral therapy.,"Neuropsychiatric adverse effects related to potent antiretroviral therapy are among the complications that can lead to poor adherence, treatment interruptions, or change of antiretroviral therapy regimens. For a historical perspective, we review early literature and case reports with CNS adverse effects attributed to antiretrovirals. The variability of the cerebrospinal fluid penetration of individual antiretrovirals may contribute to their potential for behavioural and psychiatric manifestations. The majority of neuropsychiatric complications related to potent antiretroviral therapy have been associated with the use of the efavirenz. Updates on the risk of neuropsychiatric manifestations with efavirenz use in patients with a history of psychiatric disorders or substance abuse are reviewed. We include a critical review of recently published data on the long-term CNS adverse effects with efavirenz. Special attention is given to the results of recent investigations on the relationship between the pharmacogenomics of genes responsible for efavirenz metabolism and the plasma concentration of efavirenz. It is important to note that there is no established direct correlation of efavirenz concentrations and symptoms. It is not recommended for practitioners to adjust efavirenz doses in order to prevent or alleviate CNS adverse effects. Patients may be placed at risk for virological failure and resistance if they receive suboptimal doses of efavirenz. The aim of this article is to give a concise review and an update on recent literature concerning neuropsychiatric effects of antiretroviral use in HIV-infected patients. Our intent is to present practitioners with data that can be used in a practical way to both educate and improve outcomes in the HIV-infected patient population."
