PMID,title,abstract
18691049,Therapeutic drug monitoring in the management of HIV-infected patients.,"The rate of HIV-positive patients that fails to reach or to maintain a durable virological suppression under anti-retroviral (ARV) therapy might be as high as 50%, therefore new tools to improve ARV drug efficacy are urgently needed. Among others, therapeutic drug monitoring (TDM) is a strategy by which the dosing regimen for a patient is guided by measurement of plasma drug levels, enabling physicians to optimize ARV drug efficacy and to avoid drug-related toxicity. The most used analytical methods to determine plasma levels of ARV drugs are HPLC-UV and HPLC-MS(/MS), recently MALDI-based methods and enzyme immunoassay (EIA) technologies have been also employed. The wide inter-patient variability in ARV drug pharmacokinetic supports the application of TDM to the clinical management of HIV-infected patients. Drug-drug and drug-food interactions, drug binding to plasma proteins, drug sequestering by erythrocytes, hepatic impairment, sex, age, pregnancy, and host genetic factors are sources of inter-patient variability affecting ARV drug pharmacokinetics. Combining the information of TDM and resistance tests in genotypic inhibitory quotient (GIQ) is likely to be of great clinical utility. Indeed, only two clinical trials on GIQ, both conducted using ARV drugs not more commonly in use, have shown clinical benefits. The design of new trials with long follow-up and sample size representative of the current HIV prevalence is urgently needed to give indications for GIQ as an early predictor of virological response. Here, the basic principles and the available methods for TDM in the management of HIV-infected patients are reviewed."
18753410,A novel CCR5-specific pharmacodynamic assay in whole blood using phosphoflow cytometry highlights different ligand-dependent responses but similar properties of antagonists in CD8+ and CD4+ T lymphocytes.,"Chemokine CC motif receptor (CCR) 5 is a major drug target for both inflammation and virology indications. The primary function of CCR5 is to mediate the trafficking of CCR5-expressing lymphocytes to any of the CCR5 ligands, which are often increased during inflammatory responses. In addition, CCR5 is a coreceptor for HIV, mediating R5 tropic HIV infection of CCR5-expressing CD4 T cells. We report the use of a novel method to assay the pharmacodynamic (PD) properties of small-molecule and antibody inhibitors of CCR5 ligand-induced activation by measuring phosphorylation of serine residue 349 in the cytoplasmic tail of human CCR5 using phosphoflow cytometry in whole blood. This assay is highly specific and measures CCR5 phosphorylation in both CD8(+) and CD4(+) T cells and allows the calculation of inhibitor IC(50) values from both lymphocyte subsets in the presence of CCR5 antagonists. In addition, this assay is cross-reactive to nonhuman primates and allows PD analysis in whole blood from rhesus and cynomolgus macaque. Using this assay, we identified different ligand-dependent response properties between CD8(+) and CD4(+) T cells, although CCR5 antagonists behave with similar properties against both cell types. The use of this assay may be of particular benefit to monitor PD effects of CCR5 inhibitors during drug development, preclinical in vivo studies, and in patients currently being treated for HIV or CCR5-mediated inflammatory diseases with CCR5 inhibitors. Similar phosphoflow approaches to other GPCR targets on circulating lymphocytes may prove to be the most reliable PD assay for preclinical and potentially clinical development."
18753937,Rational use of antiretroviral therapy in low-income and middle-income countries: optimizing regimen sequencing and switching.,
18767290,[Principles of therapeutic drug monitoring].,"Requesting a blood level measurement of a drug is part of the global approach known as ""Therapeutic Drug Monitoring"". Diverse situations require this monitoring approach, such as inadequate response to treatment or organ failure. Every drug however does not possess all the characteristics for a TDM program. The therapeutic range of a TDM drug has indeed to be narrow and its interindividual pharmacokinetic variability to be wide. As the development of new drugs is currently slowing down, the precise management of existing treatments certainly deserves progress, but needs however to be applied rationally, starting from a valid indication to blood sampling, and ending with a sound dosage adaptation decision."
18767291,[Therapeutic drug monitoring: clinical practice].,"When requesting a blood level measurement in the context of ""Therapeutic drug monitoring"" (TDM), numerous aspects have to be considered in the pre-analytical and analytical area, as in the integration of associated clinical data. This review presents therapeutic classes for which a clinical benefit of TDM is established or suggested, at least in some settings. For each class of drugs, the main pharmacokinetic, pre-analytical, analytical and clinical aspects are evaluated in the scope of such a monitoring. Each step of the TDM process is important and none should be neglected. Additional clinical trials are however warranted to better establish the exact conditions of use for such a monitoring."
18784460,Evaluation of the WHO criteria for antiretroviral treatment failure among adults in South Africa.,"OBJECTIVE: To assess the performance of WHO clinical and CD4 cell count criteria for antiretroviral treatment (ART) failure among HIV-infected adults in a workplace HIV care programme in South Africa. DESIGN: Cohort study. METHODS: We included initially ART-naive participants who remained on first-line therapy and had an evaluable HIV viral load result at the 12-month visit. WHO-defined clinical and CD4 cell count criteria for ART failure were compared against a gold standard of virological failure. RESULTS: Among 324 individuals (97.5% men, median age 40.2, median starting CD4 cell count and viral load 154 cells/mul and 47,503 copies/ml, respectively), 33 (10.2%) had definite or probable virological failure at 12 months, compared with 19 (6.0%) and 40 (12.5%) with WHO-defined CD4 and clinical failure, respectively. CD4 criteria had a sensitivity of 21.2% and a specificity of 95.8% in detecting virological failure, and clinical criteria had sensitivity of 15.2% and specificity of 88.1%. The positive predictive value of CD4 and clinical criteria in detecting virological failure were 36.8 and 12.8%, respectively. Exclusion of weight loss or tuberculosis failed to improve the performance of clinical criteria. CONCLUSION: WHO clinical and CD4 criteria have poor sensitivity and specificity in detecting virological failure. The low specificities and positive predictive values mean that individuals with adequate virological suppression risk being incorrectly classified as having treatment failure and unnecessarily switched to second-line therapy. Virological failure should be confirmed before switching to second-line therapy."
18931536,"Single-measurement therapeutic drug monitoring of the HIV/AIDS drugs abacavir, zidovudine, lamivudine, efavirenz, nevirapine, lopinavir and nelfinavir.","BACKGROUND: There is currently no consensus about the significance of therapeutic drug monitoring (TDM) in the management of human immunodeficiency virus (HIV) infection. OBJECTIVES: In this study, single drug levels from routine clinical samples were determined in order to add further data on the therapeutic plasma level range and on drug levels under anti-HIV therapy in general. MATERIALS AND METHODS: A total of 215 plasma samples obtained from patients with HIV infection for whom TDM was requested for the first time were evaluated. Plasma values were determined for abacavir and zidovudine between 1 and 3 h after drug intake. Lamivudine, efavirenz, nevirapine, lopinavir and nelfinavir plasma values were determined between 1 and 12 h after drug intake. Drug levels were determined with a home-brewed assay based on high-performance liquid chromatography. RESULTS: Plasma concentrations of HIV drugs showed a large variability. Plasma concentrations of abacavir, zidovudine and lamivudine were found to be similar to those reported recently. For efavirenz and nevirapine, 37 and 61% of the samples did not meet the minimum trough levels suggested. For lopinavir and nelfinavir, the majority of the samples (78 and 80%) were found to be within the therapeutic plasma level range. CONCLUSION: Despite a large variation of anti-HIV drug plasma concentrations, single-measurement TDM may be sufficient in the routine management of the majority of patients."
18935683,Adherence strategies. Monitoring of treatment can help ART resistance. Sustained treatment interruption is worst.,
18941777,Policies and practices for the clinical management of HIV/HCV coinfected children in Europe: an epidemiological survey.,"The antenatal prevalence of HIV/HCV coinfection ranges from 12% to 28% with mother-to-child transmission rates ranging from 3.6% to 9.5%. There are no guidelines detailing the most appropriate clinical management and treatment of coinfected children. We used a semi-structured questionnaire to investigate current European practices for the management and follow-up of HIV/HCV coinfected children among clinical centres contributing to the European Collaborative Study or the European Paediatric HCV Network. Clinicians from 16 out of 24 clinical centres responded and were caring for a total of 44 HIV/HCV coinfected children. We found that, although there was a high level of concordance regarding testing for HIV and/or HCV infection, monitoring practices in these European centres varied widely. Few clinicians stated they would administer HIV and HCV treatment concurrently. Limited experience in the clinical management of this group and the lack of an evidence base to guide policy may be a barrier to achieving optimal care and treatment."
18991109,Comparison of model-based tests and selection strategies to detect genetic polymorphisms influencing pharmacokinetic parameters.,"We evaluate by simulation three model-based methods to test the influence of a single nucleotide polymorphism on a pharmacokinetic parameter of a drug: analysis of variance (ANOVA) on the empirical Bayes estimates of the individual parameters, likelihood ratio test between models with and without genetic covariate, and Wald tests on the parameters of the model with covariate. Analyses are performed using the FO and FOCE method implemented in the NONMEM software. We compare several approaches for model selection based on tests and global criteria. We illustrate the results with pharmacokinetic data on indinavir from HIV-positive patients included in COPHAR 2-ANRS 111 to study the gene effect prospectively. Only the tests based on the EBE obtain an empirical type I error close to the expected 5%. The approximation made with the FO algorithm results in a significant inflation of the type I error of the LRT and Wald tests."
19005265,HIV clinical trial design for antiretroviral development: moving forward.,
19008174,Low trough levels of tipranavir in a combination antiretroviral therapy of tipranavir/ritonavir and tenofovir require therapeutic drug monitoring.,"The new non-peptidic protease inhibitor tipranavir is used boosted with ritonavir in a 500/200 mg bid scheme. Multiple drug interactions are described for both drugs because of their different action in CYP450 3A4 and p-glycoprotein. In this retrospective analysis of 22 patients during therapy with tipranavir/ritonavir (TPV) 500 mg/200 mg bid, we found significantly decreased TPV-trough levels in combination with tenofovir (15.32+/-5.22 microg/ml) in comparison to TPV trough levels without tenofovir (20.21+/-14.87 microg/ml). Therapeutic drug monitoring of TPV is recommended."
19050389,Low atazanavir concentrations in cerebrospinal fluid.,"OBJECTIVE: Protease inhibitors may not penetrate into the central nervous system in therapeutic concentrations, which may allow ongoing HIV replication and injury. The objective of this study was to determine atazanavir penetration into cerebrospinal fluid (CSF). DESIGN: Single random plasma or paired plasma and CSF samples were drawn from participants enrolled in a multicenter, observational cohort study and taking atazanavir with or without ritonavir between October 2003 and October 2005. METHODS: Plasma samples were assayed by high performance liquid chromatography and immunoassay; lower limit of detection was 45 ng/ml. CSF samples were assayed by immunoassay (ARK ATV-test); lower limit of detection was 5 ng/ml. RESULTS: One hundred and seventeen participants (43 +/- 7.7 years, 79% men, 81 +/- 15 kg) had plasma or plasma and CSF paired samples drawn a median (interquartile range) of 10 (5-17) h postdose. Median (interquartile range) plasma atazanavir concentrations with or without ritonavir were 1278 (525-2265) and 523 (283-1344) ng/ml. The median (interquartile range) CSF concentrations with or without ritonavir were 10.3 (<5-21.1) and 7.9 (6.6-22) ng/ml. Nineteen of 79 (24%) CSF samples were less than 5 ng/ml. CSF concentrations were less than 1% of plasma concentrations and near the atazanavir wild-type IC50 of 1-11 ng/ml. CONCLUSION: Atazanavir CSF concentrations are highly variable and 100-fold lower than plasma concentrations, even with ritonavir boosting. CSF concentrations of atazanavir do not consistently exceed the wild-type IC50 of atazanavir and may not protect against HIV replication in the CSF."
19052483,Pharmacokinetic study of the variability of indinavir drug levels when boosted with ritonavir in HIV-infected children.,"The aim of this work is to: (1) assess therapeutic drug monitoring of indinavir (IDV) during clinical routine practice in HIV-infected children, whose antiretroviral treatment includes IDV boosted with ritonavir (RTV), and (2) describe a possible relationship between IDV pharmacokinetics and MDR1 genotypes. In 21 ambulatory pediatric patients receiving IDV plus RTV, IDV plasma levels and MDR1 genotypes on exon 26 (C3435T) were determined. Nine of the 21 patients initially receiving 250 mg/m(2) IDV yielded trough levels below 0.10 microg/ml (median: 0.21, range: 0.04-1.31 microg/ml). When the dosage was increased to 400 mg/m(2) IDV plus 100 mg/m(2) RTV b.i.d., all, except 1 patient, achieved levels above 0.10 microg/ml. Pharmacokinetic analysis showed higher volume of distribution median values related to the C/C genotype in comparison with C/T or T/T genotypes for exon 26 (4.57 vs. 1.20 and 1.50 l/kg, respectively; p = 0.002). Although a higher median value of clearance was observed with the C/C genotype, the difference was not statistically significant (1.43 vs. 0.27 and 0.42 l/h, respectively; p = 0.052). These results may be explained by a reduced absorption of the drug, related with lower plasma IDV levels in patients carrying the C/C genotype in exon 26."
19059744,"Quantification of etravirine (TMC125) in plasma, dried blood spots and peripheral blood mononuclear cell lysate by liquid chromatography tandem mass spectrometry.","For the quantification of the novel non-nucleoside reverse transcriptase inhibitor etravirine in human plasma, dried blood spots and peripheral blood mononuclear cell (PBMC) lysate, an assay was developed and validated, using liquid chromatography coupled with tandem mass spectrometry. Etravirine was extracted from plasma by means of protein precipitation with a mixture of methanol and acetonitrile using only 50 microL plasma. Extraction from dried blood spots was performed with a one-step extraction with a mixture of methanol, acetonitrile and 0.2M zinc sulphate in water (1:1:2, v/v/v) and extraction from cell lysate was performed in 50% methanol in water. Chromatographic separation was performed on a reversed phase C18 column (150mmx2.0mm, particle size 5microm) with a quick stepwise gradient using an acetate buffer (pH 5) and methanol, at a flow rate of 0.25mL/min. (13)C(6)-efavirenz was used as an internal standard. The analytical run time was only 10min. The triple quadrupole mass spectrometer was operated in the positive ion-mode and multiple reaction monitoring was used for drug quantification. The method was validated over a range of 25-5000ng/mL in plasma, 50-10,000ng/mL in dried blood spots and a range of 5-2500ng/mL in PBMC lysate. Accuracies ranged from 89% to 106% in plasma, from 94% to 109% in dried blood spots and from 91% to 105% in PBMC lysate. Precisions at the all concentration levels ranged from 1.9% to 14% in plasma, 4.7% to 20% in dried blood spots and from 3.1% to 11% in PBMC lysate. The bioanalytical assay was successfully incorporated with previously developed assays for the determination of all currently approved PIs and NNRTIs in plasma and dried blood spots and it is now applied for therapeutic drug monitoring and pharmacological research in HIV-infected patients treated with etravirine."
19089608,Lack of association between retrospectively collected pharmacy refill data and electronic drug monitoring of antiretroviral adherence.,"Antiretroviral medication refill adherence has not been compared directly to electronic drug monitoring (EDM) in any identifiable published study. We retrospectively studied adults with undetectable HIV titers on highly active antiretroviral therapy. We used Pearson correlation coefficients and receiver operating characteristic curves to relate the two adherence measures, and we used the Wilcoxon rank-sum test to assess the relation between adherence and viral load. In sixty-five subjects, the majority of whom were African American and male with median age of 44 years, pharmacy refill adherence was difficult to collect retrospectively, was not significantly correlated with EDM adherence, and was not significantly related to viral load. Ninety-day supply pharmacy refill adherence correctly classified 95% EDM adherence maximally at 94 days between refills, and the measure was most sensitive for non-adherence at <90 days. Reassessment of the relation between pharmacy refill data and EDM would be warranted when pharmacy refill data is collected as soon as feasible from sources with complete data capture."
19103115,[Study on the threshold of HIV-1 drug resistance in Hunan province].,"OBJECTIVE: To survey the prevalence of HIV-1 drug resistance in patients newly diagnosed as HIV positive and who were younger than 25 years of age but had not received treatment with antiretroviral treatment (ART) in Hunan province. METHODS: Serum specimens of HIV infected individuals were collected and HIV-1 pol genetic mutations associated with drug resistance were identified with PCR and interpreted with Stanford HIV Drug Resistance Database. RESULTS: A total number of 69 patients whose HIV sequences were amplified successfully with 2 (2.9%) specimens appeared mutations associated with HIV-1 drug resistance in the reverse transcriptase region, including one as V75M and the other one as K103N and V181C. Data showed that the prevalence of drug resistance in Hunan was 2.9%. CONCLUSION: The first line regiments of national ART seemed still effective. Most of the AIDS patients did not need to be tested on drug resistance status before starting ART. However, it is important to start HIV drug resistance surveillance in no time."
19114860,"A randomized trial of therapeutic drug monitoring of protease inhibitors in antiretroviral-experienced, HIV-1-infected patients.","OBJECTIVE: Whether therapeutic drug monitoring of protease inhibitors improves outcomes in HIV-infected patients is controversial. We evaluated this strategy in a randomized, open-label clinical trial, using a normalized inhibitory quotient (NIQ), which incorporates drug exposure and viral drug resistance. NIQs < or = 1 may predict poor outcome and identify patients who could benefit from dose escalation. DESIGN/METHODS: Eligible patients had a viral load > or =1000 copies/ml on a failing regimen, and began a new protease inhibitor containing regimen at entry. All FDA-approved protease inhibitors available during the study recruitment (June 2002-May 2006) were allowed. One hundred and eighty-three participants with NIQ < or = 1, on the basis of their week 2 protease inhibitor trough concentration and pre-entry drug resistance test, were randomized at week 4 to standard of care (SOC) or protease inhibitor dose escalation (TDM). The primary endpoint was change in log10 plasma HIV-1 RNA concentration from randomization to 20 weeks later. RESULTS: Ninety-one patients were randomized to SOC and 92 to TDM. NIQs increased more in the TDM arm compared to SOC (+69 versus +25%, P = 0.01). Despite this, TDM and SOC arms showed no difference in outcome (+0.09 versus +0.02 log10, P = 0.17). In retrospective subgroup analyses, patients with less HIV resistance to their protease inhibitors benefited from TDM (P = 0.002), as did black and Hispanic patients (P = 0.035 and 0.05, respectively). Differences between black and white patients persisted when accounting for protease inhibitor susceptibility. CONCLUSIONS: There was no overall benefit of TDM. In post hoc subgroup analyses, TDM appeared beneficial in black and Hispanic patients, and in patients whose virus retained some susceptibility to the protease inhibitors in their regimen."
19128911,"Quantification of the HIV-integrase inhibitor raltegravir and detection of its main metabolite in human plasma, dried blood spots and peripheral blood mononuclear cell lysate by means of high-performance liquid chromatography tandem mass spectrometry.","For the quantification of the HIV-integrase inhibitor raltegravir in human plasma, dried blood spots and peripheral blood mononuclear cell (PBMC) lysate, an assay was developed and validated, using liquid chromatography coupled with tandem mass spectrometry. The assay also allowed detection, but no quantification due to absence of reference substance, of the main metabolite, raltegravir-glucuronide. Raltegravir was extracted from plasma by means of protein precipitation with a mixture of methanol and acetonitrile using only 50microL plasma. Extraction from dried blood spots was performed with a simple one-step extraction with a mixture of methanol, acetonitrile and 0.2M zincsulphate in water (1:1:2, v/v/v) and extraction from cell lysate was performed in 50% methanol in water. Chromatographic separation was performed on a reversed phase C18 column (150mmx2.0mm, particle size 5microm) with a quick stepwise gradient using an acetate buffer (pH 5) and methanol, at a flow rate of 0.25mL/min. The analytical run time was 10min. The triple quadrupole mass spectrometer was operated in the positive ion-mode and multiple reaction monitoring was used for drug quantification. The method was validated over a range of 50-10,000ng/mL in plasma and dried blood spots and a range of 1-500ng/mL in PBMC lysate. Dibenzepine was used as the internal standard. The method was proven to be specific, accurate, precise and robust. Accuracies ranged from 104% to 105% in plasma, from 93% to 105% in dried blood spots and from 82% to 113% in PBMC lysate. Precision over the complete concentration range was less than 6%, 11% and 13% in plasma, dried blood spots and PBMC lysate, respectively. The method is now applied for therapeutic drug monitoring and pharmacological research in HIV-infected patients treated with raltegravir."
19133532,Guidelines for antiretroviral therapy in HIV-1 infected adults and adolescents: the recommendations of the Thai AIDS Society (TAS) 2008.,"BACKGROUND: More than 100,000 patients have been treated, since the implementation of the National Universal Coverage for antiretroviral therapy (ART) in Thailand Although there are several comprehensive guidelines available internationally, there is a need to have guidelines that can be implemented in Thailand. MATERIAL AND METHOD: The guidelines were developed by a panel of 17 members who are the experts on HIV research and/or HIV patient care and appointed without incentive by the Thai AIDS Society (TAS). The recommendations were based on evidences from the published studies and availability of antiretroviral agents. Published studies that are relevant and applicable to Thailand in particular have been taken into consideration. RESULTS: The recommendations include: when to start ART; what to start; how to monitor the therapy; adverse effects and its management; diagnosis of treatment failure; and antiretroviral treatment options in patients with treatment failure. ART in special circumstances, i.e., patients with co-infection of tuberculosis or hepatitis B virus, is also included Appropriate level of CD4+ T-cell count to start ART among Thai patients has been considered carefully. The authors recommend to start ART at CD4+ T-cell count < 200 cells/mm3. CONCLUSION: ART should be initiated in adults and adolescents HIV-1 infected patients with a history of HIV-related illness or AIDS or with a CD4+ T-cell count <200 cells/mm3. For treatment-naive patients, the preferred initial therapy is a non-nucleoside reverse transcriptase inhibitor (NNRTI)-based regimen. CD4' T-cell count and viral load should be monitored for at least twice and once a year, respectively. Proper management of antiretroviral-related toxicity and enhancement of adherence are crucial for the long-term success of ART."
