PMID,title,abstract
20658830,Electronic monitoring-based counseling to enhance adherence among HIV-infected patients: a randomized controlled trial.,"OBJECTIVE: To investigated the effectiveness of an adherence intervention (AIMS) designed to fit HIV-clinics\' routine care procedures. DESIGN: Through block randomization, patients were allocated to the intervention or control group. The study included 2 months baseline measurement, 3 months intervention, and 4 months follow-up. HIV-nurses delivered a minimal intervention (""adherence sustaining"") to patients scoring >95% adherence at baseline, and an intensive intervention (""adherence improving"") to patients with <95% adherence. Control participants received high-quality usual care. MAIN OUTCOME MEASURES: Electronically monitored adherence and viral load. RESULTS: 133 patients were included (67 control, 66 intervention), 60% had <95% adherence at baseline, and 87% (116/133) completed the trial. Intent-to-treat analyses showed that adherence improved significantly in the complete intervention sample. Subgroup analyses showed that this effect was caused by participants scoring <95% at baseline (mean difference = 15.20%; p < .001). These effects remained stable during follow-up. The number of patients with an undetectable viral load increased in the intervention group compared to the control group (OR = 2.96, p < .05). Treatments effects on viral load were mediated by the improvements in adherence. CONCLUSIONS: The AIMS-intervention was effective and can be integrated in routine clinical care for HIV-infected patients. Future research should study its (cost)effectiveness among more heterogeneous samples and in settings with variable levels of standard care."
20679511,A retrospective evaluation of pretreatment and follow-up monitoring of HIV-infected adult patients in a resource-poor setting.,"The rapid scale-up of antiretroviral therapy (ART) is associated with the challenges of ensuring that HIV care delivered to clients is of the highest quality. This study was designed to evaluate the pretreatment and 12 month follow-up monitoring of clinical and laboratory profiles of HIV-infected patients at the adult HIV clinic of the University of Ilorin Teaching Hospital, in Nigeria. It was a retrospective analysis of records of 440 adult patients who were on follow-up visits for 1 or more years. Two hundred two (45.9%) were male and 238 (54.1%) were female. Weight was documented at baseline in 314 (71.4%) and at month 12 of follow-up in 258 (58.6%). Baseline World Health Organization (WHO) clinical stage was documented in 269 (61.1%). Baseline CD4 count, full blood count (FBC), creatinine (Cr), liver function tests (LFT), fasting blood sugar (FBS), and fasting serum lipids (FSL) were documented in 243 (55.6%), 260 (59.1%), 143 (32.5%), 136 (30.9%), 268 (60.9%), and 161 (36.6%), respectively. At 12th month of follow-up visit, the CD4 count, FBC, Cr, LFT, FBS, and FSL were documented in 121 (27.5%), 94 (21.4%), 59 (13.4%), 77 (17.5%), 179 (40.7%), and 95 (21.6%), respectively. This report shows that the pretreatment and the 12th-month follow-up monitoring of HIV-infected adult patients in our center was less than optimal. We recommend periodic self-assessment by care providers to monitor compliance with standards."
20720517,The convergence of therapeutic drug monitoring and pharmacogenetic testing to optimize efavirenz therapy.,"The aim of this study was to show the benefits of combining therapeutic drug monitoring (TDM) and pharmacogenetic analyses to optimize efavirenz (EFV) therapy. Patients were selected to minimize nongenetic differences between patients: 32 HIV adherent patients without drug interactions treated with an EFV nonindividualized dose over at least 1 year and included in a TDM program were genotyped according to minimum steady-state concentrations (C ss min). The EFV plasma concentrations (n = 158) were quantified by high-performance liquid chromatography-ultraviolet, and genetic polymorphisms were analyzed using the PHARMAchip. Central nervous system side effects were assessed systematically. Genetic polymorphisms were detected in 79.2% of patients with EFV Css min outside the therapeutic range (1-4 mg/L), showing the high diagnostic efficacy of combining TDM with pharmacogenetic testing. CYP2B6 (516 G>T) polymorphisms were associated with a significant decrease in EFV plasma clearance in 80% of the poor metabolizer patients (G/T, T/T). All homozygous patients had C ss min greater than 4 mg/L, 75% of them showing central nervous system side effects. For such patients, pharmacogenetic testing with TDM could be advantageous because the polymorphism is a determinant of these circumstances and TDM would allow reductions in dose to be specified without assuming an equal dose for any given genotype. In fact, poor metabolizer patients required less than a 600 mg standard starting dose, implying that if CYP2B6 screening were available, EFV therapy could be started at 400 mg and later TDM-individualized. The results of this study clarify the genotype versus phenotype debate for optimizing drug therapy. Pharmacogenetic testing together with TDM links genotype to phenotypic differences in drug concentrations and adverse events, providing additional support for dosage adjustment and a more efficient use of both approaches. As genotype screens become cheaper, and in combination with TDM, adjusting dosages in the light of genetic polymorphisms will become a reality."
20726906,Therapeutic drug monitoring of lopinavir/ritonavir in pregnancy.,"OBJECTIVES: The aim of the study was to determine total and unbound lopinavir (LPV) plasma concentrations in HIV-infected pregnant women receiving lopinavir/ritonavir (LPV/r tablet) undergoing therapeutic drug monitoring (TDM) during pregnancy and postpartum. METHODS: Women were enrolled in the study who were receiving the LPV/r tablet as part of their routine prenatal care. Demographic and clinical data were collected and LPV plasma (total) and ultrafiltrate (unbound) concentrations were determined in the first, second and third trimesters using high-performance liquid chromatography-tandem mass spectrometry (HPLC-MS/MS). Postpartum sampling was performed where applicable. Antepartum and postpartum trough concentrations (C(trough) ) were compared independently [using analysis of variance (anova)] and on a longitudinal basis (using a paired t-test). RESULTS: Forty-six women were enrolled in the study (38 Black African). Forty women initiated LPV/r treatment in pregnancy. Median (range) gestation at initiation was 25 (15-36) weeks and median (range) baseline CD4 count and viral load were 346 (14-836) cells/muL and 8724 (<50-267408) HIV-1 RNA copies/mL, respectively. Forty women (87%) had LPV concentrations above the accepted minimum effective concentration for wild-type virus (MEC; 1000 ng/mL). Geometric mean (95% confidence interval [CI]) total LPV concentrations in the first/second [3525 (2823-4227) ng/mL; n=16] and third [3346 (2813-3880) ng/mL; n=43] trimesters were significantly lower relative to postpartum [5136 (3693-6579) ng/mL; n=12] (P=0.006). In a paired analysis (n=12), LPV concentrations were reduced in the third trimester [3657 (2851-4463) ng/mL] vs. postpartum (P=0.021). No significant differences were observed in the LPV fraction unbound (fu%). Conclusions The above target concentrations achieved in the majority of women and similarities in the fu% suggest standard dosing of the LPV/r tablet is appropriate during pregnancy. However, reduced LPV concentrations in the second/third trimesters and potentially compromised adherence highlight the need for TDM-guided dose adjustment in certain cases."
20731076,[Monitoring HIV antiretroviral therapy in Africa].,
20731678,The use of human immunodeficiency virus resistance tests in clinical practice.,"Important progress has been made in recent years in the development and clinical use of drugs for the treatment of human immunodeficiency virus type 1 (HIV-1) infection. Nevertheless, when antiretroviral therapy fails to be fully suppressive, new viral variants emerge, thus allowing HIV-1 to escape from drug pressure by accumulating mutations. Between 50% and 70% of treated patients with virological rebound harbour some form of drug-resistant virus; transmitted drug resistance in drug-naive populations has reached 5-20% in areas of the world with access to treatment. The emergence of drug-resistant viruses remains the limiting factor in HIV-1 management, being a major cause of treatment failure, and being associated with clinical progression and death. All international guidelines focus on the importance of tailoring antiretroviral therapy to the individual patient, on the basis onf HIV-1 genetic data, integrated with clinical, laboratory and therapeutic information. The aim of this review is to provide useful information to clinicians and virologists about how and when to use genotypic resistance testing in clinical practice, especially in the management of the first stages of HIV-1 patient care and treatment decisions."
20847524,Development and application of a simple LC-MS method for the determination of plasma maraviroc concentrations.,"Maraviroc is an orally available antagonist of the CCR5 chemokine receptor, which acts as a human immunodeficiency virus type 1 (HIV-1) coreceptor. Binding of maraviroc to this receptor blocks HIV-1 attachment to the coreceptor and prevents HIV-1 from entering host cells. Maraviroc does not require intracellular processing to exert this activity. Drug interaction studies have shown changes in maraviroc exposure when given with other anti-HIV medications, and thus quantification of maraviroc in human plasma is important to manage drug interactions and to evaluate the relationship between plasma concentrations and treatment response. We developed a conventional LC-MS method for determining plasma maraviroc concentrations, validated by estimating precision and accuracy for inter- and intraday analysis in the concentration range of 0.011-2.188 microg/ml. The calibration curve was linear within this range. The average accuracy ranged from 92.7% to 99.7%, while the relative standard deviations of both inter- and intraday assays were less than 7.1%. Recovery of maraviroc exceeded 86.7%. Our LC-MS method provides a conventional, accurate and precise way to determine the maraviroc concentration in human plasma. This method enables dose adjustment based on monitoring plasma maraviroc concentrations and permits management of drug interactions and toxicity."
20854461,HIV in 2010: potent antiretroviral drugs treat and sensitive assays monitor the infection; but there remain outstanding issues.,
20870096,Nurse management of HIV-infected patients.,
20925507,Achieving a quantitative understanding of antiretroviral drug efficacy.,
20926993,Exposure-related effects of atazanavir on the pharmacokinetics of raltegravir in HIV-1-infected patients.,"Raltegravir (RAL) is primarily metabolized by uridine diphosphate-glucorunosyl transferase 1A1 (UGT1A1). Atazanavir (ATV), a strong inhibitor of UGT1A1, has been shown to increase plasma concentrations of RAL by approximately 50% in healthy volunteers. However, the extent of this interaction has not been studied in HIV-infected patients. A pharmacokinetic study was performed in 22 HIV-infected adults treated with 400 mg RAL plus 300 mg ATV 300 twice a day. Both drugs showed high pharmacokinetic variability (RAL AUC 0-12 7649 +- 4862 ng*h/mL; ATV AUC 0-12 = 19237 +- 13136 ng*h/mL). Notably, RAL trough concentrations were significantly higher compared with those measured in HIV subjects (n = 24) on RAL plus nucleoside reverse transcriptase inhibitors (506 +- 411 versus 177 +- 262 ng/mL, P < 0.01). A significant correlation was found between RAL and ATV area under the curve (AUC) (r = 0.611, P = 0.005). Notably, patients with ATV AUC 0-12 above the mean or with concentrations exceeding the half maximal inhibitory concentration for UGT1A1 had twofold higher RAL AUCs compared with patients with lower ATV exposure. Coadministration of ATV significantly increased plasma concentrations of RAL, especially in HIV-1-infected patients exposed to high concentrations of the protease inhibitor. This pharmacokinetic drug interaction could be handled by routine measurements of ATV trough concentrations and by the assessment of plasma RAL concentrations 2 to 3 hours after the morning drug intake."
20953692,Standard measures are inadequate to monitor pediatric adherence in a resource-limited setting.,"This study aims to compare the use and cost of objective and subjective measures of adherence to pediatric antiretroviral treatment in a primary care facility in South Africa. In a 1-month longitudinal study of 53 caregiver-child dyads, pharmacy refill (PR), measurement of returned syrups (RS), caregiver self-report (3DR) and Visual Analogue Scale (VAS) were compared to Medication Event Monitoring System (MEMS). Adherence was 100% for both VAS and 3DR; by PR and RS 100% and 103%, respectively. MEMS showed that 92% of prescribed doses were administered, but only 66% of these within the correct 12-hourly interval. None of the four measures correlated significantly with MEMS. MEMS data suggest that timing of doses is often more deviant from prescribed than expected and should be better addressed when monitoring adherence. Of all, MEMS was by far the most expensive measure. Alternative, cheaper electronic devices need to be more accessible in resource-limited settings."
20957423,"A preliminary randomized controlled trial of a nurse-delivered medication adherence intervention among HIV-positive outpatients initiating antiretroviral therapy in Beijing, China.","We evaluated a nurse-delivered adherence intervention in a preliminary randomized controlled trial among 70 HIV-positive outpatients initiating antiretroviral therapy (ART) in Beijing, China. In both arms, participants received a 30-min educational session, a pillbox, and a referral to a peer support group. In the enhanced arm, participants could choose an electronic reminder device, three sessions of counseling either alone or with a treatment adherence partner, or both reminder and counseling. Survey assessments and blood draws occurred at baseline, post-intervention (13 weeks), and follow-up (25 weeks). Primary outcomes were 7-day and 30-day adherence assessed by self-report and electronic drug monitoring (EDM), and secondary outcomes were HIV-1 RNA viral load and CD4 count. The intervention was feasible and well received. It led to some improvement in self-reported and EDM-assessed adherence but not the biological outcomes. Providing counseling and facilitating the use of electronic reminders to patients initiating ART merits further investigation as a culturally viable means of promoting adherence in China."
21039218,"Viral load predicts new world health organization stage 3 and 4 events in HIV-infected children receiving highly active antiretroviral therapy, independent of CD4 T lymphocyte value.","BACKGROUND: Many resource-limited countries rely on clinical and immunological monitoring without routine virological monitoring for human immunodeficiency virus (HIV)-infected children receiving highly active antiretroviral therapy (HAART). We assessed whether HIV load had independent predictive value in the presence of immunological and clinical data for the occurrence of new World Health Organization (WHO) stage 3 or 4 events (hereafter, WHO events) among HIV-infected children receiving HAART in Latin America. METHODS: The NISDI (Eunice Kennedy Shriver National Institute of Child Health and Human Development International Site Development Initiative) Pediatric Protocol is an observational cohort study designed to describe HIV-related outcomes among infected children. Eligibility criteria for this analysis included perinatal infection, age <15 years, and continuous HAART for >=6 months. Cox proportional hazards modeling was used to assess time to new WHO events as a function of immunological status, viral load, hemoglobin level, and potential confounding variables; laboratory tests repeated during the study were treated as time-varying predictors. RESULTS: The mean duration of follow-up was 2.5 years; new WHO events occurred in 92 (15.8%) of 584 children. In proportional hazards modeling, most recent viral load >5000 copies/mL was associated with a nearly doubled risk of developing a WHO event (adjusted hazard ratio, 1.81; 95% confidence interval, 1.05-3.11; P = .033), even after adjustment for immunological status defined on the basis of CD4 T lymphocyte value, hemoglobin level, age, and body mass index. CONCLUSIONS: Routine virological monitoring using the WHO virological failure threshold of 5000 copies/mL adds independent predictive value to immunological and clinical assessments for identification of children receiving HAART who are at risk for significant HIV-related illness. To provide optimal care, periodic virological monitoring should be considered for all settings that provide HAART to children."
21054866,"Cost analysis of centralized viral load testing for antiretroviral therapy monitoring in Nicaragua, a low-HIV prevalence, low-resource setting.","BACKGROUND: HIV viral load testing as a component of antiretroviral therapy monitoring is costly. Understanding the full costs and the major sources of inefficiency associated with viral load testing is critical for optimizing the systems and technologies that support the testing process. The objective of our study was to estimate the costs associated with viral load testing performed for antiretroviral therapy monitoring to both patients and the public healthcare system in a low-HIV prevalence, low-resource country. METHODS: A detailed cost analysis was performed to understand the costs involved in each step of performing a viral load test in Nicaragua, from initial specimen collection to communication of the test results to each patient's healthcare provider. Data were compiled and cross referenced from multiple information sources: laboratory records, regional surveillance centre records, and scheduled interviews with the key healthcare providers responsible for HIV patient care in five regions of the country. RESULTS: The total average cost of performing a viral load test in Nicaragua varied by region, ranging from US$99.01 to US$124.58, the majority of which was at the laboratory level: $88.73 to $97.15 per specimen, depending on batch size. The average cost to clinics at which specimens were collected ranged from $3.31 to $20.92, depending on the region. The average cost per patient for transportation, food, lodging and lost income ranged from $3.70 to $14.93. CONCLUSIONS: The quantitative viral load test remains the single most expensive component of the process. For the patient, the distance of his or her residence from the specimen collection site is a large determinant of cost. Importantly, the efficiency of results reporting has a large impact on the cost per result delivered to the clinician and utility of the result for patient monitoring. Detailed cost analysis can identify opportunities for removing barriers to effective antiretroviral therapy monitoring programmes in limited-resource countries with low HIV prevalence."
21071165,A HPLC-MS method for the simultaneous quantification of fourteen antiretroviral agents in peripheral blood mononuclear cell of HIV infected patients optimized using medium corpuscular volume evaluation.,"A sensitive and accurate high performance liquid chromatography-mass spectrometric (HPLC-MS) method for the intracellular determination of 14 antiretroviral drugs in peripheral blood mononuclear cells (PBMCs) for HIV+ patients was validated. PBMCs are isolated by Ficoll density gradient centrifugation and cells count and the relative mean volume is performed with a Coulter( ) instrument. Extraction of drugs from PBMCs pellets was obtained with methanol:water (70:30, v/v), with quinoxaline added as internal standard, after a sonication step. Supernatant was dried and then dissolved in water/acetonitrile (60/40, v/v), before injection into a 2.1 mmx150 mm Atlantis( ) T3 3mu column. Chromatographic separations were performed using a gradient program with a mixture of water (0.05% formic acid), as mobile phase A and acetonitrile (0.05% formic acid), as mobile phase B. Analytes quantification was performed by electro-spray ionisation-single quadrupole mass spectrometry using the selected ion recording (SIR) detection mode. The positive ionization was used for the HIV protease inhibitors (PIs) indinavir, saquinavir, nelfinavir, nelfinavir M8 metabolite, amprenavir, darunavir, atazanavir, ritonavir, lopinavir, tipranavir, the integrase inhibitor (II) raltegravir and the non-nucleoside reverse transcriptase inhibitors (NNRTIs) nevirapine and etravirine, while the negative ionization is applied for efavirenz. The calibration curves were built using blank PBMCs spiked with antiretroviral drugs at concentrations ranging from 0.1 to 32 ng/mL (1-320 ng/mL for tipranavir) and fitted to a quadratic regression model weighted by 1/X. The mean extraction recovery for all PIs, II and NNRTIs was always above 82%. The method was precise, with a range of intra/inter-day percent standard deviation within 2.6-14.8%, and accurate with mean of percent coefficient of variation (CV%) from nominal values -7.85 to +9.7%. Each drug concentration evaluated was expressed in ng/mL and optimized using each patient medium corpuscolar volume and cell number. This analytical method is routinely used in our clinical research center for the assessment of intracellular levels of all PIs, raltegravir and NNRTIs commercially available at present."
21083497,Dried blood spots in HIV monitoring: applications in resource-limited settings.,"By the end of 2008, 4 million people were receiving antiretroviral treatment for HIV/AIDS in low- and middle-income countries. In industrialized countries, monitoring of treatment with viral load measurements and drug resistance testing is the standard of care to ensure early detection of treatment failure and a prompt switch to a fully active second-line regimen, before drug-resistant mutations accumulate. These tests, however, require highly specialized laboratories and stringent procedures for storage and shipment of plasma, and are rarely available in resource-limited settings. Therefore, treatment failure in such settings is usually not detected until patients develop severe immunodeficiency, at which stage widespread resistance is likely. Dried blood spots (DBS) are easy to collect and store, and can be a convenient alternative to plasma in settings with limited laboratory capacity. This review provides an overview of possible applications of DBS technologies in the monitoring of HIV treatment, with the main focus on viral load quantification and drug resistance testing."
21107266,Virologic failure and second-line antiretroviral therapy in children in South Africa--the IeDEA Southern Africa collaboration.,"BACKGROUND: With expanding pediatric antiretroviral therapy (ART) access, children will begin to experience treatment failure and require second-line therapy. We evaluated the probability and determinants of virologic failure and switching in children in South Africa. METHODS: Pooled analysis of routine individual data from children who initiated ART in 7 South African treatment programs with 6-monthly viral load and CD4 monitoring produced Kaplan-Meier estimates of probability of virologic failure (2 consecutive unsuppressed viral loads with the second being >1000 copies/mL, after >=24 weeks of therapy) and switch to second-line. Cox-proportional hazards models stratified by program were used to determine predictors of these outcomes. RESULTS: The 3-year probability of virologic failure among 5485 children was 19.3% (95% confidence interval: 17.6 to 21.1). Use of nevirapine or ritonavir alone in the initial regimen (compared with efavirenz) and exposure to prevention of mother to child transmission regimens were independently associated with failure [adjusted hazard ratios (95% confidence interval): 1.77 (1.11 to 2.83), 2.39 (1.57 to 3.64) and 1.40 (1.02 to 1.92), respectively]. Among 252 children with >=1 year follow-up after failure, 38% were switched to second-line. Median (interquartile range) months between failure and switch was 5.7 (2.9-11.0). CONCLUSIONS: Triple ART based on nevirapine or ritonavir as a single protease inhibitor seems to be associated with a higher risk of virologic failure. A low proportion of virologically failing children were switched."
