PMID,title,abstract
14699459,Use of total lymphocyte count for monitoring response to antiretroviral therapy.,"The CD4 cell count has become a key laboratory measurement in the management of human immunodeficiency virus (HIV) disease. In ideal situations, HIV-infected persons are followed up longitudinally with serial CD4 cell counts to determine disease progression, risk for opportunistic infection, and the need for prophylactic or therapeutic intervention. However, the use of the CD4 cell count in resource-limited settings is often not possible because of lack of availability and high cost. Thus, other laboratory markers have been proposed as substitutes for the CD4 cell count. The data regarding the clinical utility of the total lymphocyte count (TLC) as a potential surrogate marker of immune function in patients with HIV disease are examined. The role of the TLC in the initiation of antiretroviral therapy and opportunistic infection prophylaxis, as well as the role of the TLC in monitoring the response to antiretroviral therapy, are also addressed."
14722455,Is the influence of social desirability on patients' self-reported adherence overrated?,
14722456,Efficacy and tolerability of zalcitabine twice daily (HIVBID Study).,
15006189,Therapeutic drug monitoring of antiretroviral therapy.,"The concept of managing pharmacotherapy based on plasma drug concentrations has been used for decades in a variety of clinical settings. The interest in therapeutic drug monitoring (TDM) of antiretroviral drugs has grown significantly since highly active antiretroviral therapy (HAART) became a standard of care in clinical practice. A primary characteristic of TDM of antiretroviral drugs is that multiple agents are concomitantly used in HAART regimens. Inadequate drug concentrations may lead to evolution of drug resistance mutations and endanger present and future treatment options. A number of clinical trials have demonstrated that drug serum concentrations are an important factor in response to therapy for HIV, but whether TDM will become a tool for the routine management of HIV infection remains to be determined. This review includes an illustrative case report of measuring concentrations of antiretroviral drugs in a pediatric patient."
15006193,Growth patterns reflect response to antiretroviral therapy in HIV-positive infants: potential utility in resource-poor settings.,"Laboratory monitoring of HIV-infected children is the current standard of care in the United States to guide the appropriate use of antiretroviral therapy (ART). Although ART is becoming a reality in some developing countries, laboratory monitoring of ART is costly, necessitating creative approaches to monitoring. As an initial step to guide monitoring of HIV progression in low resource settings, we assessed the utility of the physical examination to predict clinical progression of HIV. We conducted a retrospective cohort study of HIV-infected children using data from Pediatric AIDS Clinical Trials Group Protocol 300. We developed a clinical predictive model, and compared the utility of the clinical model to the change in HIV RNA viral load as diagnostic tests of ART failure. The clinical model incorporated treatment regimen, age, and height velocity: a three-level clinical predictive model provided likelihood ratios of 0.3, 3.9, and 14. For decline in RNA the likelihood ratios were 0.2 (> 1 log decline), 1.4, and 3.5 (> log increase). We developed a simple clinical predictive model that was able to predict clinical progression of HIV after initiation of new ART. The clinical model performed similarly to using changes in HIV RNA viral load. These data should be validated internationally and prospectively, because the test subjects were from a resource rich environment and growth patterns in undernourished children may be impacted differently by HIV and its treatment. The model was most pertinent to children 36 months of age or younger, and was conducted in children receiving monotherapy and dual therapy."
15040540,Effect of individual cognitive behaviour intervention on adherence to antiretroviral therapy: prospective randomized trial.,"OBJECTIVE: A high level of adherence to antiretroviral therapy is required for complete suppression of HIV replication, immunological and clinical effectiveness. We investigated whether cognitive behaviour therapy can improve medication adherence. DESIGN: Prospective randomized 1-year trial. SETTING: Collaboration of HIV university outpatient clinic and psychotherapists in private practice. PARTICIPANTS: 60 HIV-infected persons on stable antiretroviral combination therapy and viral load below 50 copies/ml. INTERVENTION: Cognitive behaviour intervention in individual patients, in addition to standard of care. MAIN OUTCOME MEASURES: Feasibility and acceptance of intervention; adherence to therapy assessed using medication event monitoring system (MEMS) and self-report questionnaire; virological failure; psychosocial measures. RESULTS: The median number of sessions for cognitive behaviour intervention per patient during the 1-year trial was 11 (range 2-25). At months 10-12, mean adherence to therapy as assessed using MEMS was 92.8% in the intervention and 88.9% in the control group (P=0.2); the proportion of patients with adherence > or = 95% was 70 and 50.0% (P=0.014), respectively. While there was no significant deterioration of adherence during the study in the intervention arm, adherence decreased by 8.7% per year (P=0.006) in the control arm. No differences between the intervention group and standard of care group were found regarding virological outcome. Compared with the control group, participants in the intervention group perceived a significant improvement of their mental health during the study period. CONCLUSIONS: Cognitive behavioural support in addition to standard of care of HIV-infected persons is feasible in routine practice, and can improve medication adherence and mental health."
15076251,Lipid abnormalities in HIV-infected patients are not correlated with lopinavir plasma concentrations.,
15077862,Highly active antiretroviral therapy in neonates and young infants.,"As techniques for early diagnosis of HIV-infected neonates and young infants become more sophisticated, neonatal nurses will be responsible for administering a variety of antiretroviral agents. Infants infected with HIV are likely to be placed on combination therapy, with the goal of suppressing viral replication and stabilizing the immune system. Combination therapy also reduces the risk of resistance mutations associated with monotherapy. The pharmacokinetics of antiretroviral agents in neonates is under study in a variety of PACTG protocols. However, the pharmacokinetics of most antiretroviral agents in premature infants has not been studied. With the exception of zidovudine, specific dosing for these agents in the preterm population is not known. The long-term effects of antiretroviral agents on growth and development also require further study. Knowledge of the management of HIV in all populations is expanding rapidly. Access to and utilization of HIV/AIDS-related resources are essential. The reader is encouraged to check for updated recommendations for the management of HIV-infected infants on the Internet at http://AIDSinfo. nih.gov."
15090796,"Effect of prolonged discontinuation of successful antiretroviral therapy on CD4 T cells: a controlled, prospective trial.","OBJECTIVE: To compare continuous highly active antiretroviral therapy with a CD4 cell count-driven structured treatment interruption (STI) strategy. The primary end-point was the proportion of subjects maintaining CD4 cell count > 400 x 10 cells/l. Secondary end-points were to identify the dynamic and predictive variables of CD4 cell loss. METHODS: The BASTA study is a randomized, controlled, prospective trial. Patients with CD4 cell counts > 800 x 10 cells/l were enrolled and the immunological threshold to resume therapy was set to the lower normal limit of CD4 cells for HIV-uninfected adults. RESULTS: Sixty-nine patients were randomized and followed for 64 weeks. At baseline, all had undetectable plasma HIV RNA and their mean CD4 cell count was 1077 x 10 cells/l. None of the patients showed a disease progression or any AIDS-defining event. At each time point, the proportion of subjects in the STI group that had a CD4 cell count < 400 x 10 cells/l was not statistically different from the control group. In all cases, the 95% confidence interval for this difference was smaller than +/-10%. However, 57% of patients with nadir CD4 cell count 200-350 x 10 cells/l reached a CD4 cell count < 400 x 10 cells/l. This was statistically different (P = 0.02) from the nearly 90% of patients with a nadir CD4 cell count 350-500 x 10 cells/l who maintained a CD4 cell count of > 400 x 10 cells/l. CONCLUSIONS: Prolonged STI in patients with fully suppressed virus and marked immune reconstitution is generally safe. The main predictor of CD4 cell decline is the nadir CD4 cell count. Pulse therapy warrants further careful prospective evaluation to investigate virological and clinical outcomes over a very long period."
15090817,Detection of stavudine concentrations in plasma of HIV-infected patients taking zidovudine.,
15106527,"11th annual retrovirus conference. Drug update: the old, the new, the still to come.",
15186710,Preventing and managing antiretroviral drug resistance.,"Development of resistance to antiretroviral drugs (ARVs) is a major impediment to optimum treatment of HIV-1 infection. Although resistance testing can help to select subsequent regimens when virologic failure occurs, cross-resistance, which affects all classes of ARVs, may make it more difficult to achieve optimum control of HIV. We have known for some time that our first choice of antiretroviral therapy offers the best chance to control HIV replication and that initial therapy should be selected with an eye on future options. Potency is the first line of defense against the development of resistance. Other factors that affect resistance development include: tolerability, potential for optimum adherence, and genetic and pharmacologic barriers to development of resistance. If resistance emerges, only a single drug may be affected initially, and a rapid change in ARVs may preserve the efficacy of other components. One cautionary note is that we can no longer assume that a patient\'s HIV is fully susceptible to all ARVs even in the initial regimen. Transmission of drug-resistant HIV means that the genetic composition may be that of an ""experienced"" virus with reduced susceptibility to ARVs. Resistance testing at the time of transmission is most likely to reveal this resistance, but over time the dominant genetic pattern may revert to wild-type, and be missed by resistance testing. Because ""archived"" resistant HIV may emerge quickly once treatment is initiated, we need to keep this in mind when selecting initial therapy."
15203426,Clinical assessment of medication adherence among HIV-infected children: examination of the Treatment Interview Protocol (TIP).,"This paper presents findings of a multi-site study designed to document: (1) caregivers' regimen knowledge; (2) barriers to adherence; and (3) the relationships between adherence, regimen knowledge and barriers. Fifty-one predominantly female, African American parents and caregivers of HIV-infected children completed the Treatment Interview Protocol (TIP), a brief, structured interview designed to assess regimen knowledge and barriers to adherence. TIP data were compared to information obtained from medical records and pharmacy refill histories. Forty-nine per cent of children were considered adherent, defined as > or = 90% refill rate, which was significantly associated with virologic response. Significant regimen knowledge deficits were observed among caregivers, and inaccurate identification of prescribed medications was significantly associated with adherence. Caregivers identified 21 barriers to adherence, and poor adherence was significantly related to the number of barriers reported. Results indicate that the TIP is a successful tool for identifying regimen knowledge, potential adherence barriers and adherence problems. Results suggest that the TIP could be integrated into clinical practice as a quick, effective tool to identify poor adherers and guide interventions and treatment decision making."
15218140,Monitoring treatment: at what cost?,
15228148,"Therapeutic drug monitoring for patients with HIV infection: Children's National Medical Center, Washington DC experience.",This paper provides a brief overview of therapeutic drug monitoring (TDM) in patients with HIV infection. The manuscipt not only focuses on an update on TDM in HIV infection but also provides the latest information on tandem mass spectrometric methods for antiretroviral drug quantification. Also discussed are the preliminary new and original data on free antiretroviral drug measurement in both plasma and saliva.
15228151,Therapeutic drug monitoring in children with HIV/AIDS.,"In this paper we present an overview on the use of TDM in the treatment of HIV-1-infected children. The processes of growth and development have a significant impact on drug metabolism. The use of TDM makes it possible to optimize plasma drug concentrations of antiretroviral drugs. This is important when one considers that the levels of viral suppression and drug toxicity in adults and children are associated with the plasma concentration of PIs and NNRTIs. Indeed, in clinical practice the use of TDM in the treatment of HIV-1-infected children has favorable results. However, there is a serious shortage of population reference values of antiretroviral medication in children. Targeting plasma drug levels in children to adult reference values may be insufficient because of the unique features of HIV infection in children. Apart from its primary function for dose optimization, TDM can also be used as a tool to assess adherence to antiviral medication. One should, however, be cautious to base assumptions on plasma levels alone because aberrant plasma levels may also be the result of other factors such as changes in nutritional habits, drug-drug interactions, or changing gastric motility. We conclude that TDM is a useful tool in the treatment of HIV-1-infected children. Additional data are needed to establish child-specific reference values and to assess the optimal method of TDM."
15236622,Determination of indinavir and nelfinavir trough plasma concentration efficacy thresholds according to virological response in HIV-infected patients.,"BACKGROUND: There is evidence to suggest a pharmacokinetic-pharmacodynamic relationship in HIV-infected patients receiving protease inhibitor (PI)-containing highly active antiretroviral therapy (HAART); however, the effective trough PI plasma concentrations achieved have not been precisely determined. METHODS: The relationship between HIV viral load and concomitant PI trough plasma concentration (C(trough)) was evaluated in 101 patients receiving at least 4 months of thrice daily indinavir (IDV)-containing (n=68) or nelfinavir (NFV)-containing (n=33) HAART. The more discriminating C(trough) efficacy thresholds were determined statistically for each PI by using the raw C(trough) and the time-corrected C(trough), using the precise delay since the last PI intake and the half-life of each PI. RESULTS: For IDV (P=0.002) and NFV (P=0.019) median C(trough) levels were higher in patients with undetectable viral load [0.23 mg/L (n=30) and 2.3 mg/L (n=16) respectively] than in patients with detectable viral load [0.11 mg/L (n=38) and 0.6 mg/L (n=17) respectively]. C(trough) levels of IDV (r=-0.45; P<0.0001) and NFV (r=-0.43; P=0.011) were correlated with the concomitant viral load. The more discriminating C(trough) efficacy thresholds were estimated statistically as 0.12 mg/L for IDV and 0.5 mg/L for NFV. When C(trough) values were time-corrected, the C(trough) efficacy thresholds, 8 h after the last intake, were 0.15 mg/L for IDV and 0.65 mg/L for NFV. CONCLUSIONS: These results support the importance of achieving minimal effective C(trough) to improve the virological efficacy of PI-containing HAART, and specify the target concentrations for IDV and NFV."
15286240,Evaluation and treatment of the human immunodeficiency virus-1--exposed infant.,"In developed countries, care and treatment are available for pregnant women and infants that can decrease the rate of perinatal human immunodeficiency virus type 1 (HIV-1) infection to 2% or less. The pediatrician has a key role in prevention of mother-to-child transmission of HIV-1 by identifying HIV-exposed infants whose mothers' HIV infection was not diagnosed before delivery, prescribing antiretroviral prophylaxis for these infants to decrease the risk of acquiring HIV-1 infection, and promoting avoidance of HIV-1 transmission through human milk. In addition, the pediatrician can provide care for HIV-exposed infants by monitoring them for early determination of HIV-1 infection status and for possible short- and long-term toxicities of antiretroviral exposure, providing chemoprophylaxis for Pneumocystis pneumonia, and supporting families living with HIV-1 infection by providing counseling to parents or caregivers."
15286513,The changing face of AIDS.,
15328077,Population pharmacokinetics of indinavir in patients infected with human immunodeficiency virus.,"Indinavir is currently used at a fixed dose of 800 mg either three times a day or twice a day in combination with 100 mg of ritonavir. Dosage individualization based on plasma concentration monitoring might, however, be indicated. This study aimed to assess the pharmacokinetic profile of indinavir in patients infected with human immunodeficiency virus to characterize interpatient and intrapatient variability and to build up a Bayesian approach for dosage adaptation. A population analysis was performed with the NONMEM computer program with 569 plasma samples from a cohort of 239 unselected patients receiving indinavir. A one-compartment model with first-order absorption was adapted, and the influences of clinical characteristics on oral clearance (CL) and distribution volume (V) were examined. Predicted average drug exposure and trough and peak concentrations were derived for each patient and correlated with efficacy and toxicity markers. The population estimates of CL were 32.4 liters/h for female and 42.0 liters/h for male patients; oral V was 65.7 liters; and the rate constant of absorption (K(a)) was 1.0 h(-1). CL decreased by 63% with ritonavir intake and was moderately correlated to body weight. Both interpatient variability, best assigned to oral CL (coefficient of variation [CV], 39%) and K(a) (CV, 67%), and intrapatient variability were large (CV, 41%; standard deviation, 670 microg/liter). In conclusion, initial indinavir dosage should be decided according to ritonavir intake and sex, prior to plasma concentration measurements. The high interpatient pharmacokinetic variability represents an argument for therapeutic drug monitoring."
15337632,Follow-up measurements of Nevirapine plasma levels over a prolonged period.,"Over a period of more than four years of treatment, 177 Nevirapine plasma levels were taken from 27 patients. The values showed a high inter-patient variability and a lower intra-patient variability. Differences in body weight turned out to be the main reason for inter-patient variability. Treatment over a prolonged period did not result in any change in plasma concentrations. Adjusting dosage by means of therapeutic drug monitoring would appear to be a reasonable way of maximising patient benefit from treatment."
15362661,Atazanavir enhances saquinavir hard-gel concentrations in a ritonavir-boosted once-daily regimen.,"OBJECTIVE: To determine the pharmacokinetics of saquinavir hard-gel capsules/ritonavir/atazanavir co-administered once daily at 1600/100/300 mg in HIV-infected individuals. METHODS: Eighteen patients receiving saquinavir/ritonavir switched to 1600/100 mg once daily a minimum of 3 days before the study. On study day 1, levels of saquinavir and ritonavir were determined over 24 h. Atazanavir (300 mg once daily) was then added to the regimen. On day 11, a pharmacokinetic analysis was performed. Atazanavir was discontinued on day 32. Drug concentrations were measured by high-pressure liquid chromatography-tandem mass spectrometry. Geometric mean ratios (GMR) and 95% confidence intervals (CI) were used to compare saquinavir and ritonavir pharmacokinetic parameters, with and without atazanavir. A safety analysis was performed at screening, days 1, 11, 32 and follow-up. RESULTS: After the addition of atazanavir, statistically significant increases in saquinavir trough plasma concentration (Ctrough GMR, 95% CI 2.12, 1.72-3.50), maximum plasma concentration (Cmax 1.42, 1.24-1.94), area under the plasma concentration-time curve from 0-24 h (AUC0-24 1.60, 1.35-2.43) and ritonavir Cmax (1.58, 1.32-2.08), AUC0-24 (1.41, 1.22-1.74) were observed. The pharmacokinetics of atazanavir compared with those obtained in patients receiving atazanavir/ritonavir without saquinavir. Four patients developed scleral icterus and two jaundice. Total and unconjugated bilirubin increased approximately fivefold during atazanavir therapy. CONCLUSION: The addition of atazanavir to saquinavir/ritonavir increased saquinavir Ctrough, Cmax and AUC0-24 by 112, 42 and 60%. Ritonavir Cmax and AUCo-24 increased by 34 and 41%. The regimen was well tolerated, with no significant change in laboratory parameters, except for the occurrence of hyperbilirubinemia."
15366104,"Protease inhibitor boosting is complex, requires thorough knowledge of interactions.",
15369510,GENOPHAR: a randomized study of plasma drug measurements in association with genotypic resistance testing and expert advice to optimize therapy in patients failing antiretroviral therapy.,"OBJECTIVES: To evaluate the benefits of therapeutic drug monitoring (TDM) in association with genotypic resistance testing and expert advice to optimize therapy in multiexperienced patients infected with HIV-1. METHODS: Patients with a viral load>1000 HIV-1 RNA copies/mL and an unchanged antiretroviral therapy regimen over the last 3 months were randomized into two groups: a genotypic group (G) and a geno-pharmacological group (GP). Treatment was selected by an expert committee according to genotypic resistance testing (the G and GP groups) and TDM (the GP group) at week 4. Treatment could be modified at each visit according to toxicity, poor virological response and TDM. Results of TDM were withheld from the G group until week 12. The primary endpoint of the study was the percentage of patients with viral load<200 copies/mL at week 12. RESULTS: A total of 134 patients were randomized in the study, with 67 in each group, and included in the intent-to-treat (ITT) analysis. At baseline, median values were as follows: viral load (log(10) copies/mL): G=4.1, GP=4.0; CD4 cell count (cells/microL): G=292, GP=294; and number of prior drugs: G=7, GP=8. The median number of resistance mutations was five in the G group [nucleoside reverse transcriptase inhibitors (NRTIs)=three; non-nucleoside reverse transcriptase inhibitors (NNRTIs)=one; protease inhibitors (PI)=one] and seven in the GP group (NRTI=four; NNRTI=two; PI=one). At week 8, treatment was adjusted according to the TDM in 13 of the 67 patients in the GP group (19%). By ITT missing equal failure analysis at week 12, and after only one intervention according to plasma concentration results, a viral load<200 copies/mL was achieved in 30 of the 67 patients (45%) in the G group and in 29 of the 67 patients (43%) in the GP group (not significant). In the multivariate analysis, only prior exposure to at least two PIs at baseline gave a poor response to subsequent antiretroviral therapy. At week 24, a viral load<200 copies/mL was achieved in 35 of the 67 patients (52%) in the G group and in 40 of the 67 patients (60%) in the GP group. CONCLUSIONS: A statistically significant benefit of using TDM was not found in this short-term study where patients appeared to be adherent. However, combining genotypic resistance testing with the use of an expert committee to monitor subsequent therapy individually in patients with multiple resistance mutations was associated with high antiviral efficacy."
15373053,[Determination of serum levels of antiretroviral drugs].,
15384773,[A chronic infection with long-term treatment].,
